{
  "$schema": "https://json-schema.org/draft/2020-12/schema",
  "$id": "https://aidb.local/skins/_schema.json",
  "title": "Caption Skin",
  "description": "A complete captioning recipe. Source fields are authored by humans; the `_built` block is written by `python -m ait.caption.skin_build <name>` and read by use-time consumers (Skin.load, JoyNG, JoySceneDBNG, /v1-status, /todo-ai). Never hand-edit `_built`.\n\nLOAD-BEARING CONVENTION — JSON vs MD split: this JSON is the MACHINE-READABLE SURFACE (entity taxonomy, label groups, compose substitution tables, mechanical validators, concept matchers, model refs). A sibling file `conf/skins/<name>.md` (when present) is the THEME BRIEFING — intuition, scene archetypes, captioner quirks, anti-pattern principles, exemplars, stylistic preferences that don't compress well into rule rows. The JSON should stay close to a stable taxonomy + a small core of mechanical rules; new insights about the theme accumulate in the MD, not as new JSON rule rows. At /img_caption Stage 1 (per-image prompt compile with Claude in the loop) the MD is the primary input alongside applied labels and hint. At batch captioning time (no Claude composing) only the JSON-derived directive is used; slight quality degradation is the accepted tradeoff. /v1-status and /todo-ai read only the JSON.",
  "type": "object",
  "additionalProperties": false,
  "required": [
    "name",
    "version",
    "entities",
    "default_prompt",
    "user_hint_preamble",
    "post_prompt",
    "concepts",
    "model"
  ],
  "properties": {
    "name": {
      "description": "Skin identifier; must equal the JSON filename stem.",
      "type": "string",
      "pattern": "^[A-Za-z0-9_-]+$"
    },
    "version": {
      "description": "Schema version this skin was authored against.",
      "type": "integer",
      "minimum": 1
    },
    "description": {
      "type": "string"
    },
    "entities": {
      "type": "object",
      "additionalProperties": false,
      "required": ["primary"],
      "properties": {
        "primary":   { "$ref": "#/$defs/entity" },
        "secondary": { "oneOf": [{ "$ref": "#/$defs/entity" }, { "type": "null" }] }
      }
    },
    "interaction": {
      "oneOf": [{ "$ref": "#/$defs/interaction" }, { "type": "null" }]
    },
    "default_prompt": {
      "type": "string"
    },
    "user_hint_preamble": {
      "description": "Wrapper string for per-image user hints; must contain {hint}.",
      "type": "string"
    },
    "post_prompt": {
      "type": "string"
    },
    "body_type_words": {
      "description": "Map of authorizing-label -> list of words that may only appear in captions when the label is set. Keys starting with `_` are reserved for human-readable annotations and are ignored by the loader.",
      "type": "object",
      "patternProperties": {
        "^_[A-Za-z0-9_]*$": { "type": "string" },
        "^(?!_)[A-Za-z0-9_]+$": {
          "type": "array",
          "items": { "type": "string", "minLength": 1 }
        }
      },
      "additionalProperties": false
    },
    "require_trigger_presence": {
      "description": "When true, validators flag captions missing both entity phrases.",
      "type": "boolean",
      "default": false
    },
    "concepts": {
      "description": "Composite categories used by /v1-status and /todo-ai. Keys are concept names; values are match rules.",
      "type": "object",
      "additionalProperties": { "$ref": "#/$defs/concept" }
    },
    "model": {
      "$ref": "#/$defs/install_ref",
      "description": "AInstallerDB tuple for the base captioning model."
    },
    "lora": {
      "oneOf": [{ "$ref": "#/$defs/install_ref" }, { "type": "null" }],
      "description": "Optional AInstallerDB tuple for a fine-tuned LoRA adapter; null = no LoRA."
    },
    "lora_hint_path": {
      "oneOf": [{ "type": "string" }, { "type": "null" }],
      "description": "Optional direct path (local filesystem or HF repo id) to a SECOND LoRA adapter used specifically for the iter-5 hint probe in /img_suggest. When set, joy_server loads both adapters at startup; clients route hint requests via `adapter='hint'`. Decoupled from AInstallerDB for now (single-skin use case) — direct path bypasses the install-ref machinery."
    },
    "default_set": {
      "oneOf": [{ "type": "string" }, { "type": "null" }],
      "description": "SceneSet most associated with this skin; default for /v1-status and /todo-ai."
    },
    "_built": {
      "oneOf": [{ "$ref": "#/$defs/built" }, { "type": "null" }],
      "description": "Derived state written by the build phase. Optional; loader warns if missing or stale."
    }
  },

  "$defs": {
    "entity": {
      "type": "object",
      "additionalProperties": false,
      "required": ["token", "phrase"],
      "properties": {
        "description": { "type": "string" },
        "token": {
          "description": "Nonsense-word handle anchored by the LoRA, e.g. 'xlgts'.",
          "type": "string",
          "minLength": 1
        },
        "phrase": {
          "description": "Token + descriptor noun, e.g. 'xlgts woman'. Used in label-prompt interpolation.",
          "type": "string",
          "minLength": 1
        },
        "rules": {
          "type": "array",
          "items": { "type": "string", "minLength": 1 }
        },
        "forbidden": {
          "description": "Phrases the captioner must not produce when this entity is in scope.",
          "type": "array",
          "items": { "type": "string", "minLength": 1 }
        },
        "label_groups": {
          "type": "object",
          "additionalProperties": { "$ref": "#/$defs/label_group" }
        }
      }
    },

    "interaction": {
      "type": "object",
      "additionalProperties": false,
      "properties": {
        "description": { "type": "string" },
        "rules": {
          "type": "array",
          "items": { "type": "string", "minLength": 1 }
        },
        "forbidden": {
          "type": "array",
          "items": { "type": "string", "minLength": 1 }
        },
        "label_groups": {
          "type": "object",
          "additionalProperties": { "$ref": "#/$defs/label_group" }
        }
      }
    },

    "label_group": {
      "type": "object",
      "additionalProperties": false,
      "required": ["labels"],
      "properties": {
        "description": { "type": "string" },
        "labels": {
          "description": "Array of label objects in declaration order. Each label has a unique `name`, an optional human-readable `description`, and an `expansion` template (placeholders use {entities.primary.phrase} etc.).",
          "type": "array",
          "items": { "$ref": "#/$defs/label" }
        },
        "compose": {
          "description": "Optional context-aware composition rule for this group's labels. When present, `Skin.render_label_prompts` selects verb/subject at render time based on co-occurring labels (e.g. picks 'lies close to' when secondary.pose.lying is also applied). Labels in such a group should additionally carry a `target` field. If absent, the static `expansion` is used unchanged.",
          "$ref": "#/$defs/group_compose"
        }
      }
    },

    "group_compose": {
      "type": "object",
      "additionalProperties": false,
      "required": ["kind", "default", "template_primary", "template_secondary"],
      "properties": {
        "kind": {
          "description": "Which composition strategy this group uses. Only 'subject_verb_by_secondary_pose' is currently implemented.",
          "type": "string",
          "enum": ["subject_verb_by_secondary_pose"]
        },
        "subject_verb_by_secondary_pose": {
          "description": "Map of secondary.pose.<leaf> -> {subject, verb}. The first leaf in declaration order that is present in the applied labels wins. `verb` is a fragment like 'lies close to' (no period); placeholders allowed.",
          "type": "object",
          "patternProperties": {
            "^[A-Za-z0-9_]+$": { "$ref": "#/$defs/compose_rule" }
          },
          "additionalProperties": false
        },
        "default": {
          "description": "Fallback rule when no entry in the keyed map matches.",
          "$ref": "#/$defs/compose_rule"
        },
        "template_primary": {
          "description": "Sentence template used when the selected rule has subject='primary'. Placeholders: {entities.primary.phrase}, {entities.secondary.phrase}, {verb}, {target}.",
          "type": "string"
        },
        "template_secondary": {
          "description": "Sentence template used when the selected rule has subject='secondary'. Placeholders: {entities.primary.phrase}, {entities.secondary.phrase}, {verb}, {target}.",
          "type": "string"
        }
      }
    },

    "compose_rule": {
      "type": "object",
      "additionalProperties": false,
      "required": ["subject", "verb"],
      "properties": {
        "subject": {
          "description": "Which entity is the grammatical subject of the rendered sentence.",
          "type": "string",
          "enum": ["primary", "secondary"]
        },
        "verb": {
          "description": "Verb fragment, e.g. 'lies close to'. May contain {entities.secondary.phrase} etc.",
          "type": "string",
          "minLength": 1
        }
      }
    },

    "label": {
      "type": "object",
      "additionalProperties": false,
      "required": ["name", "expansion"],
      "properties": {
        "name": {
          "description": "Unique label identifier (used as the SceneImage label key).",
          "type": "string",
          "pattern": "^[A-Za-z0-9_]+$"
        },
        "description": {
          "description": "Human-readable note: what this label means and when to apply it.",
          "type": "string"
        },
        "expansion": {
          "description": "Label-prompt template — the sentence inserted into the model prompt when this label is on an image. Placeholders are interpolated at build time. When the enclosing group has a `compose` rule, this expansion is used only as a static fallback (e.g. for tools that don't call render_label_prompts).",
          "type": "string"
        },
        "target": {
          "description": "Body-part phrase (e.g. 'her mouth') used as the {target} placeholder in compose templates. Required when the enclosing group has a `compose` rule; ignored otherwise.",
          "type": "string"
        },
        "migration": {
          "description": "Accumulating log of migration notes. Each entry is a free-text string prefixed with an ISO-8601 CET/CEST timestamp with seconds, e.g. `'2026-05-10T20:30:42+02:00: renamed from b_muscular; SceneImages tagged with the old name should be relabeled before training'`. New notes are appended; the list is cleared only by a manual flush (TBD).",
          "type": "array",
          "items": { "type": "string", "minLength": 1 }
        }
      }
    },

    "concept": {
      "type": "object",
      "additionalProperties": false,
      "anyOf": [
        { "required": ["labels"] },
        { "required": ["label_prefix"] },
        { "required": ["residual"] }
      ],
      "properties": {
        "description":         { "type": "string" },
        "labels":              { "type": "array", "items": { "type": "string", "minLength": 1 } },
        "label_prefix":        { "type": "array", "items": { "type": "string", "minLength": 1 } },
        "residual":            { "type": "boolean" },
        "ignore_labels":       {
          "description": "For residual concepts: labels in this list don't qualify an image for the residual match (e.g. attribute-only images shouldn't trigger `general`).",
          "type": "array",
          "items": { "type": "string", "minLength": 1 }
        },
        "ignore_label_prefix": {
          "description": "For residual concepts: labels with these prefixes don't qualify an image for the residual match.",
          "type": "array",
          "items": { "type": "string", "minLength": 1 }
        },
        "target":              { "type": "integer", "minimum": 0 },
        "sub_concepts": {
          "type": "object",
          "additionalProperties": { "$ref": "#/$defs/concept" }
        }
      }
    },

    "install_ref": {
      "type": "object",
      "additionalProperties": false,
      "required": ["group", "variant", "target"],
      "properties": {
        "group":   { "type": "string", "minLength": 1 },
        "variant": { "type": "string", "minLength": 1 },
        "target":  { "type": "string", "minLength": 1 }
      }
    },

    "built": {
      "type": "object",
      "additionalProperties": false,
      "required": ["version", "built_at", "source_hash", "directive", "labels", "label_to_group", "label_to_entity", "forbidden"],
      "properties": {
        "version":     { "type": "integer", "minimum": 1 },
        "built_at":    { "type": "string", "description": "ISO-8601 UTC timestamp." },
        "source_hash": { "type": "string", "description": "SHA-256 of the source fields used to compose this build." },
        "directive": {
          "description": "Composed canonical recipe text sent to both system and user roles.",
          "type": "string"
        },
        "labels": {
          "description": "Flat lookup of label PATH -> rendered (placeholder-interpolated) sentence. Paths are `<entity>.<group>.<leaf>`.",
          "type": "object",
          "patternProperties": {
            "^[A-Za-z0-9_]+\\.[A-Za-z0-9_]+\\.[A-Za-z0-9_]+$": { "type": "string" }
          },
          "additionalProperties": false
        },
        "label_to_group":  {
          "description": "Reverse index: label path -> 'primary.<group>' / 'secondary.<group>' / 'interaction.<group>'.",
          "type": "object",
          "patternProperties": {
            "^[A-Za-z0-9_]+\\.[A-Za-z0-9_]+\\.[A-Za-z0-9_]+$": { "type": "string" }
          },
          "additionalProperties": false
        },
        "label_to_entity": {
          "description": "Reverse index: label path -> 'primary' | 'secondary' | 'interaction'.",
          "type": "object",
          "patternProperties": {
            "^[A-Za-z0-9_]+\\.[A-Za-z0-9_]+\\.[A-Za-z0-9_]+$": { "type": "string", "enum": ["primary", "secondary", "interaction"] }
          },
          "additionalProperties": false
        },
        "forbidden": {
          "description": "Union of primary.forbidden + secondary.forbidden + interaction.forbidden.",
          "type": "array",
          "items": { "type": "string", "minLength": 1 }
        }
      }
    }
  }
}
