{
  "name": "1xlasm",
  "version": 1,
  "description": "Two-entity giantess captioning skin. The xlgts woman is the larger figure; the xlasm man is the smaller adult-man partner. Trained for the gts dataset; carries a fine-tuned LoRA adapter for caption-quality on this domain.",
  "entities": {
    "primary": {
      "description": "The giantess woman, the larger figure. Trigger phrase: '{entities.primary.phrase}'.",
      "token": "xlgts",
      "phrase": "xlgts woman",
      "rules": [
        "Identify her ONLY as '{entities.primary.phrase}'. Do not use 'tall', 'large', 'giant', 'huge', 'towering', 'enormous', 'massive', 'colossal', or any numerical heights — the trigger phrase carries her size concept.",
        "Do not describe her body type or breast prominence unless an explicit instruction later in this prompt authorizes it."
      ],
      "forbidden": [
        "giantess",
        "tall woman",
        "large woman",
        "big woman",
        "huge woman",
        "giant woman",
        "towering",
        "enormous",
        "massive woman",
        "colossal",
        "gigantic",
        "titanic",
        "monstrous",
        "immense",
        "extremely tall",
        "super tall",
        "incredibly tall",
        "amazon"
      ],
      "label_groups": {
        "attribute": {
          "description": "Body-type attributes of the woman. Opt-in: only describe in the caption when the corresponding label is set on the image.",
          "labels": [
            {
              "name": "muscular",
              "description": "",
              "expansion": "The {entities.primary.phrase} has a muscular bodybuilder physique with visible muscle definition.",
              "migration": [
                "2026-05-10T20:00:00+02:00: renamed from 'b_muscular' the b_ prefix was dropped because label groups now carry the attribute taxonomy. SceneImages still tagged with 'b_muscular' in the DB must be relabeled to 'muscular' before training, or until that's done a runtime alias must map them."
              ]
            },
            {
              "name": "busty",
              "description": "",
              "expansion": "The {entities.primary.phrase} has prominently large breasts.",
              "migration": [
                "2026-05-10T20:00:00+02:00: renamed from 'b_busty' the b_ prefix was dropped because label groups now carry the attribute taxonomy. SceneImages still tagged with 'b_busty' in the DB must be relabeled to 'busty' before training, or until that's done a runtime alias must map them."
              ]
            },
            {
              "name": "slim",
              "description": "",
              "expansion": "The {entities.primary.phrase} has a slim athletic build.",
              "migration": [
                "2026-05-10T20:00:00+02:00: renamed from 'b_slim' the b_ prefix was dropped because label groups now carry the attribute taxonomy. SceneImages still tagged with 'b_slim' in the DB must be relabeled to 'slim' before training, or until that's done a runtime alias must map them."
              ]
            },
            {
              "name": "curvy",
              "description": "",
              "expansion": "The {entities.primary.phrase} has curvy hourglass proportions.",
              "migration": [
                "2026-05-10T20:00:00+02:00: renamed from 'b_curvy' the b_ prefix was dropped because label groups now carry the attribute taxonomy. SceneImages still tagged with 'b_curvy' in the DB must be relabeled to 'curvy' before training, or until that's done a runtime alias must map them."
              ]
            },
            {
              "name": "hairy",
              "description": "",
              "expansion": "The {entities.primary.phrase}s pubic area is hairy.",
              "migration": [
                "2026-05-10T20:00:00+02:00: renamed from 'b_hairy' the b_ prefix was dropped because label groups now carry the attribute taxonomy. SceneImages still tagged with 'b_hairy' in the DB must be relabeled to 'hairy' before training, or until that's done a runtime alias must map them."
              ]
            }
          ]
        },
        "pose": {
          "description": "Orientation, posture, and overall positioning of the woman.",
          "labels": [
            {
              "name": "front",
              "description": "",
              "expansion": "The {entities.primary.phrase} is seen from the front.",
              "migration": [
                "2026-05-10T20:30:00+02:00: renamed from 'woman_front' (drop woman_ prefix; legacy label remains in SceneImage.labels for backward compat)."
              ]
            },
            {
              "name": "back",
              "description": "",
              "expansion": "The {entities.primary.phrase} is seen from the back.",
              "migration": [
                "2026-05-10T20:30:00+02:00: renamed from 'woman_back' (drop woman_ prefix; legacy label remains in SceneImage.labels for backward compat)."
              ]
            },
            {
              "name": "side",
              "description": "",
              "expansion": "The {entities.primary.phrase} is seen from the side.",
              "migration": [
                "2026-05-10T20:30:00+02:00: renamed from 'woman_side' (drop woman_ prefix; legacy label remains in SceneImage.labels for backward compat)."
              ]
            },
            {
              "name": "sitting",
              "description": "",
              "expansion": "The {entities.primary.phrase} is sitting.",
              "migration": [
                "2026-05-10T20:30:00+02:00: renamed from 'woman_sitting' (drop woman_ prefix; legacy label remains in SceneImage.labels for backward compat)."
              ]
            },
            {
              "name": "on_back",
              "description": "",
              "expansion": "The {entities.primary.phrase} is on his back.",
              "migration": [
                "2026-05-10T20:30:00+02:00: renamed from 'woman_on_back' (drop woman_ prefix; legacy label remains in SceneImage.labels for backward compat)."
              ]
            },
            {
              "name": "all4",
              "description": "",
              "expansion": "The {entities.primary.phrase} is on her all fours.",
              "migration": []
            },
            {
              "name": "tower",
              "description": "",
              "expansion": "The {entities.primary.phrase} stands directly above the {entities.secondary.phrase}, with him positioned at her feet or lower leg level.",
              "migration": []
            },
            {
              "name": "standing",
              "description": "The woman is standing upright on her feet.",
              "expansion": "The {entities.primary.phrase} is standing upright.",
              "migration": []
            },
            {
              "name": "kneeling",
              "description": "figure is on one or both knees.",
              "expansion": "The {entities.primary.phrase} is kneeling.",
              "migration": []
            },
            {
              "name": "arms_spread",
              "description": "arms held wide apart, away from the body.",
              "expansion": "The {entities.primary.phrase} has her arms spread wide apart.",
              "migration": []
            },
            {
              "name": "legs_spread",
              "description": "legs held wide apart.",
              "expansion": "The {entities.primary.phrase} has her legs spread wide apart.",
              "migration": []
            }
          ]
        },
        "action": {
          "description": "Actions the woman performs (toward herself or directed at the man).",
          "labels": [
            {
              "name": "step",
              "description": "",
              "expansion": "The {entities.primary.phrase} is stepping on the {entities.secondary.phrase} with her foot.",
              "migration": []
            },
            {
              "name": "holding",
              "description": "",
              "expansion": "The {entities.secondary.phrase} is held by the {entities.primary.phrase}.",
              "migration": []
            },
            {
              "name": "blowjob",
              "description": "",
              "expansion": "The {entities.primary.phrase} is giving the {entities.secondary.phrase} a blowjob, with his erect penis inserted into her mouth and her lips closed on his penis. The blowjob is the central content of the image.",
              "migration": []
            },
            {
              "name": "handjob",
              "description": "",
              "expansion": "The {entities.primary.phrase} is giving the {entities.secondary.phrase} a handjob, stimulating and stroking his penis with her hand. The handjob is the central content of the image.",
              "migration": []
            },
            {
              "name": "teasing_hj",
              "description": "",
              "expansion": "The {entities.primary.phrase} is giving the {entities.secondary.phrase} a teasing handjob, stimulating and stroking his penis delicately with her fingers. The teasing handjob is the central content of the image.",
              "migration": []
            },
            {
              "name": "job",
              "description": "",
              "expansion": "The {entities.primary.phrase} is giving the {entities.secondary.phrase} either a handjob or a blowjob.",
              "migration": []
            }
          ]
        }
      }
    },
    "secondary": {
      "description": "The adult man, the smaller figure. Trigger phrase: '{entities.secondary.phrase}'. Always adult-proportioned regardless of apparent size.",
      "token": "xlasm",
      "phrase": "xlasm man",
      "rules": [